{
    "slug": "dkdi",
    "relevant-countries": [
        "dk"
    ],
    "name": "Datatilsynet (Data Inspectorate of Denmark)",
    "address": "Carl Jacobsens Vej 35\n2500 Valby\nDenmark",
    "phone": "+45 33 19 32 00",
    "fax": "+45 33 19 32 18",
    "email": "dt@datatilsynet.dk",
    "web": "https://www.datatilsynet.dk/",
    "sources": [
        "https://www.datatilsynet.dk/kontakt/"
    ],
    "complaint-language": "da"
}
