{
    "slug": "evolutionjobs",
    "relevant-countries": [
        "gb"
    ],
    "name": "Evolution Recruitment Solutions Ltd",
    "address": "The Genesis Centre\nBirchwood\nWarrington\nWA3 7BH\nUnited Kingdom",
    "email": "privacy@evolutionjobs.com",
    "web": "https://www.evolutionjobs.com/uk/",
    "sources": [
        "https://www.iubenda.com/privacy-policy/54951181",
        "https://github.com/datenanfragen/data/issues/191"
    ],
    "suggested-transport-medium": "email"
}